{
  "$schema": "../schemas/ux-rule.schema.json",
  "schemaVersion": 1,
  "id": "ux-action-hierarchy",
  "title": "Jerarquía y semántica de acciones",
  "intent": "Evitar competencia visual y conservar el significado de color, posición y agrupación.",
  "priority": "must",
  "appliesTo": {
    "intents": [
      "crud",
      "form",
      "detail",
      "wizard",
      "dashboard",
      "transaction",
      "document",
      "settings"
    ],
    "components": [
      "button",
      "table-action",
      "action-group",
      "form-dialog"
    ]
  },
  "requirements": [
    {
      "id": "one-primary-per-region",
      "statement": "Permitir como máximo una acción primary por región de acciones.",
      "enforcedBy": [
        "recipe",
        "generator",
        "visual"
      ]
    },
    {
      "id": "semantic-tones",
      "statement": "Usar tonos para consecuencias o estados reales. En el perfil catalog, consultar usa ojo neutro, editar lápiz azul y activar marca verde; desactivar conserva papelera roja. La consulta no debe compartir el verde de activación.",
      "enforcedBy": [
        "catalog",
        "recipe",
        "review"
      ]
    },
    {
      "id": "visible-action-limit",
      "statement": "ActionGroup cuenta solo acciones directas con maxVisible. PaginaCrud conserva por defecto dos directas (Ver y Editar) y el disparador Más completa el tercer control físico; el resto va al desbordamiento accesible.",
      "enforcedBy": [
        "recipe",
        "unit",
        "a11y"
      ]
    },
    {
      "id": "color-needs-label",
      "statement": "Acompañar el color con texto, etiqueta accesible, icono semántico y agrupación comprensible.",
      "enforcedBy": [
        "generator",
        "a11y",
        "review"
      ]
    },
    {
      "id": "catalog-contextual-state",
      "statement": "En catálogos con baja lógica declarada, Activar, Desactivar, Eliminar y Revertir usan isMenuOnly y conservan su confirmación independiente; nunca ocupan una acción directa por defecto ni se mezclan con Guardar.",
      "enforcedBy": [
        "catalog",
        "unit",
        "review"
      ]
    },
    {
      "id": "catalog-contextual-direct-exception",
      "statement": "Una tercera acción directa contextual requiere id existente, justificación no vacía y evidencia no vacía mediante accionDirectaContextual. No puede ser Ver, Editar, Activar, Desactivar, Eliminar, Revertir, isMenuOnly, delete, deactivate, reverse, danger ni una identidad contradictoria Ver/Editar. Cuando existe desbordamiento, esa excepción crea un cuarto control físico documentado.",
      "enforcedBy": [
        "catalog",
        "unit",
        "review"
      ]
    }
  ],
  "acceptance": [
    "Una barra generada nunca contiene dos acciones primary.",
    "El catálogo estándar presenta Ver, Editar y Más acciones como tres controles físicos; el menú es navegable por teclado.",
    "Una cuarta acción física solo existe con evidencia contextual declarada.",
    "Las acciones peligrosas incluyen etiqueta explícita, isMenuOnly y confirmación cuando corresponda."
  ],
  "evidence": [
    "docs/POLITICA_COLOR_ACCIONES.md",
    "src/app/shared/ui/molecules/action-group/action-group.component.ts",
    "src/app/shared/ui/atoms/table-action/table-action.ts",
    "docs/CONTRATO_CATALOGOS_CRUD.md"
  ]
}
