{
  "$schema": "../schemas/ux-rule.schema.json",
  "schemaVersion": 1,
  "id": "ux-dialog-behavior",
  "title": "Comportamiento de diálogos",
  "intent": "Mantener foco, jerarquía, scroll y cierre predecibles en formularios y confirmaciones.",
  "priority": "must",
  "appliesTo": {
    "intents": ["crud", "detail", "form", "wizard", "transaction", "document", "authentication", "settings"],
    "components": ["crud-dialog", "form-dialog", "modal", "button", "alert", "toast", "summary-list", "pagina-crud"]
  },
  "requirements": [
    {
      "id": "readonly-detail-content",
      "statement": "La consulta de catálogo conserva el chasis Atomic y muestra SummaryList layout=detail: etiquetas y valores semánticos, sin formulario, controles deshabilitados, obligatoriedad ni Guardar. Alta/edición usan controles; la confirmación de estado es una intención separada. El bloqueo temporal durante un envío no es una vista de consulta.",
      "enforcedBy": ["review"]
    },
    {
      "id": "async-result-focus",
      "statement": "Conservar el diálogo y enfocar el feedback local tras fallo; cerrar, restaurar foco y anunciar el éxito fuera del overlay tras una resolución correcta.",
      "enforcedBy": ["catalog", "recipe", "unit", "a11y", "review"]
    },
    {
      "id": "declarative-open-state",
      "statement": "Sincronizar apertura y cierre mediante el contrato público del diálogo, sin manipular su DOM desde una feature.",
      "enforcedBy": ["catalog", "recipe", "generator", "gate"]
    },
    {
      "id": "focus-cycle",
      "statement": "Mover el foco al primer control útil, enfocar el primer inválido al enviar y devolver foco al disparador al cerrar.",
      "enforcedBy": ["generator", "unit", "a11y"]
    },
    {
      "id": "reset-scroll",
      "statement": "Reiniciar la posición vertical al abrir o reutilizar el diálogo.",
      "enforcedBy": ["unit", "visual"]
    },
    {
      "id": "safe-cancel",
      "statement": "Impedir cierre o cancelación destructiva mientras una mutación no cancelable está en progreso.",
      "enforcedBy": ["recipe", "generator", "unit"]
    }
  ],
  "acceptance": [
    "Ver conserva cabecera, cierre y pie; presenta dl/dt/dd, ningún control de captura y solo Cerrar. Probar también Editar y la reapertura para evitar perder el foco al reemplazar contenido.",
    "busy bloquea X, Escape y backdrop; loading bloquea envíos repetidos de la acción principal.",
    "Escape sigue el mismo contrato de cancelación que el botón secundario.",
    "La navegación por teclado permanece dentro del diálogo modal.",
    "Cerrar restaura el foco sin saltos de scroll."
  ],
  "evidence": [
    "src/app/shared/ui/molecules/modal/modal.component.ts",
    "src/app/shared/ui/atoms/button/button.component.ts",
    "src/app/shared/ui/organisms/crud-dialog/crud-dialog.ts",
    "src/app/shared/ui/organisms/form-dialog/form-dialog.ts",
    "docs/CONTRATO_CATALOGOS_CRUD.md"
  ]
}
